{"schema_version":"0.1","profession_id":"search-relevance-engineer","compiled_on":"2026-09-12","research_packet":"research/cohorts/51-60/search-relevance-engineer.json","research_packet_blob_sha":"a3e755eda0e721f83c377a5350f45505cbf220da","audited_body_blob_sha":"f8aaf7f7d63e3cc15de8c3f4d6b42695af232956","body_rewrite":false,"maturity_effect":"NO_CHANGE","authority_boundary_preserved":true,"dispositions":[{"gap_id":"search-relevance-engineer-boundary-gap","decision":"ADOPTED","target_files":["maps/profession.json"],"rationale":"Compile the research-backed boundary into the package-local map without widening maturity.","residual_gap":"Observed practice, broader human-profession depth and cross-intelligence execution remain untested."}],"adopted_files":["maps/profession.json"],"nonclaims":["Search / Relevance Engineer remains EXPERIMENTAL.","Occupational grounding and schema-valid package structure do not prove competence."]}