{"schema_version":"0.1","profession_id":"audio-mixing-engineer","compiled_on":"2026-09-12","research_packet":"research/cohorts/90-100/audio-mixing-engineer.json","research_packet_blob_sha":"7e5e84c6cd750dd2395366c4949690da294ea50a","audited_body_blob_sha":"345890120c5b77969d764bac1a55434940dc3277","body_rewrite":false,"maturity_effect":"NO_CHANGE","authority_boundary_preserved":true,"dispositions":[{"gap_id":"audio-mixing-engineer-boundary-gap","decision":"ADOPTED","target_files":["maps/profession.json"],"rationale":"Compile the research-backed boundary into the package-local map without widening maturity.","residual_gap":"Observed practice, broader human-profession depth, target-runtime use and cross-intelligence execution remain untested."}],"adopted_files":["maps/profession.json"],"nonclaims":["Audio Mixing Engineer remains EXPERIMENTAL.","Occupational grounding and schema-valid package structure do not prove competence."]}