{"schema_version":"0.1","profession_id":"operations-manager","compiled_on":"2026-09-12","research_packet":"research/cohorts/79-89/operations-manager.json","research_packet_blob_sha":"d40efe2bd5f2a784a535a97b15745b3b31a61907","audited_body_blob_sha":"05221219762ca6b4752a2c06b4287ba4023f1f23","body_rewrite":false,"maturity_effect":"NO_CHANGE","authority_boundary_preserved":true,"dispositions":[{"gap_id":"operations-manager-boundary-gap","decision":"ADOPTED","target_files":["maps/profession.json"],"rationale":"Compile the research-backed boundary without widening maturity.","residual_gap":"Observed practice and cross-intelligence execution remain untested."}],"adopted_files":["maps/profession.json"],"nonclaims":["Operations Manager remains EXPERIMENTAL.","Occupational grounding/package validity do not prove professional competence or grant institutional authority."]}