{"schema_version":"0.1","profession_id":"motion-designer","compiled_on":"2026-09-12","research_packet":"research/cohorts/90-100/motion-designer.json","research_packet_blob_sha":"b5e0439ce5a5b8886521bf50adcc62103597ec34","audited_body_blob_sha":"d1e9aefe68f9f500068feab540acb4a2e926f497","body_rewrite":false,"maturity_effect":"NO_CHANGE","authority_boundary_preserved":true,"dispositions":[{"gap_id":"motion-designer-boundary-gap","decision":"ADOPTED","target_files":["maps/profession.json"],"rationale":"Compile the research-backed boundary into the package-local map without widening maturity.","residual_gap":"Observed practice, broader human-profession depth, target-runtime use and cross-intelligence execution remain untested."}],"adopted_files":["maps/profession.json"],"nonclaims":["Motion Designer remains EXPERIMENTAL.","Occupational grounding and schema-valid package structure do not prove competence."]}