{"schema_version":"0.1","profession_id":"distributed-systems-engineer","compiled_on":"2026-09-12","research_packet":"research/cohorts/31-40/distributed-systems-engineer.json","research_packet_blob_sha":"5a9eb5a3af8d270b567c28984efeb918f5c63603","audited_body_blob_sha":"1d95e68ba58bdffb8b6ad368ef0a06f3228b50af","body_rewrite":false,"maturity_effect":"NO_CHANGE","authority_boundary_preserved":true,"dispositions":[{"gap_id":"distributed-network-boundary-gap","decision":"ADOPTED","target_files":["maps/profession.json"],"rationale":"The external baseline crosses software/network concerns, so the package explicitly prevents protocol evidence from becoming infrastructure guarantees.","residual_gap":"Observed distributed practice, real network faults and cross-intelligence execution remain untested."}],"adopted_files":["maps/profession.json"],"nonclaims":["Distributed Systems remains EXPERIMENTAL.","No TEST scope or broad fault-tolerance claim is created.","Network/SRE/infrastructure guarantees remain separately owned."]}
