{"schema_version":"0.1","profession_id":"ux-writer","compiled_on":"2026-09-12","research_packet":"research/cohorts/90-100/ux-writer.json","research_packet_blob_sha":"f95257dd77958870dacf3be12a3f072b371246a5","audited_body_blob_sha":"5039058456460dd464706cb9e17a0741bb289b15","body_rewrite":false,"maturity_effect":"NO_CHANGE","authority_boundary_preserved":true,"dispositions":[{"gap_id":"ux-writer-boundary-gap","decision":"ADOPTED","target_files":["maps/profession.json"],"rationale":"Compile the research-backed boundary into the package-local map without widening maturity.","residual_gap":"Observed practice, broader human-profession depth, target-runtime use and cross-intelligence execution remain untested."}],"adopted_files":["maps/profession.json"],"nonclaims":["UX Writer / Content Designer remains EXPERIMENTAL.","Occupational grounding and schema-valid package structure do not prove competence."]}