{"schema_version":"0.1","profession_id":"identity-access-engineer","compiled_on":"2026-09-12","research_packet":"research/cohorts/71-78/identity-access-engineer.json","research_packet_blob_sha":"7d7dddf1813c1e844588d272e79c26209ef2fa94","audited_body_blob_sha":"b2eca191cac2f82a8ce42a183697a6c918a1f011","body_rewrite":false,"maturity_effect":"NO_CHANGE","authority_boundary_preserved":true,"dispositions":[{"gap_id":"identity-access-engineer-boundary-gap","decision":"ADOPTED","target_files":["maps/profession.json"],"rationale":"Compile the research-backed boundary without widening maturity.","residual_gap":"Observed practice and cross-intelligence execution remain untested."}],"adopted_files":["maps/profession.json"],"nonclaims":["Identity & Access Engineer remains EXPERIMENTAL.","No authorization, permission, certification, risk acceptance, legal authority or physical/security access is created by this compilation."]}