{"schema_version":"0.1","profession_id":"model-serving-engineer","compiled_on":"2026-09-12","research_packet":"research/cohorts/51-60/model-serving-engineer.json","research_packet_blob_sha":"f87e39e54b66477d73d1cb43580c26e03d2029b1","audited_body_blob_sha":"dbc8a25bdf39ff08c40815b36f05172468c7efe9","body_rewrite":false,"maturity_effect":"NO_CHANGE","authority_boundary_preserved":true,"dispositions":[{"gap_id":"model-serving-engineer-boundary-gap","decision":"ADOPTED","target_files":["maps/profession.json"],"rationale":"Compile the research-backed boundary into the package-local map without widening maturity.","residual_gap":"Observed practice, broader human-profession depth and cross-intelligence execution remain untested."}],"adopted_files":["maps/profession.json"],"nonclaims":["Model Serving Engineer remains EXPERIMENTAL.","Occupational grounding and schema-valid package structure do not prove competence."]}