{"schema_version":"0.1","profession_id":"project-manager","compiled_on":"2026-09-12","research_packet":"research/cohorts/79-89/project-manager.json","research_packet_blob_sha":"c6d007c934e91407e045c60fb7fbb8e7c4a1b727","audited_body_blob_sha":"6bbb565f52325a8f905bcdc84db279d25a3fbd1b","body_rewrite":false,"maturity_effect":"NO_CHANGE","authority_boundary_preserved":true,"dispositions":[{"gap_id":"project-manager-boundary-gap","decision":"ADOPTED","target_files":["maps/profession.json"],"rationale":"Compile the research-backed boundary without widening maturity.","residual_gap":"Observed practice and cross-intelligence execution remain untested."}],"adopted_files":["maps/profession.json"],"nonclaims":["Project Manager remains EXPERIMENTAL.","Occupational grounding/package validity do not prove professional competence or grant institutional authority."]}