{"schema_version":"0.1","profession_id":"design-systems-specialist","compiled_on":"2026-09-12","research_packet":"research/cohorts/61-70/design-systems-specialist.json","research_packet_blob_sha":"8fdec1f540e419a98a3053b480bb3b158e4d9ad3","audited_body_blob_sha":"2b2526f91270d60066978cd0e8fa22f3218a6f6b","body_rewrite":false,"maturity_effect":"NO_CHANGE","authority_boundary_preserved":true,"dispositions":[{"gap_id":"design-systems-specialist-boundary-gap","decision":"ADOPTED","target_files":["maps/profession.json"],"rationale":"Compile the research-backed boundary into the package-local map without widening maturity.","residual_gap":"Observed practice, broader human-profession depth and cross-intelligence execution remain untested."}],"adopted_files":["maps/profession.json"],"nonclaims":["Design Systems Specialist remains EXPERIMENTAL.","Occupational grounding and schema-valid package structure do not prove competence."]}