{"schema_version":"0.1","profession_id":"ai-safety-engineer","compiled_on":"2026-09-12","research_packet":"research/cohorts/41-50/ai-safety-engineer.json","research_packet_blob_sha":"1e1a3500edfbddc64161ac904b53283061469903","audited_body_blob_sha":"0c52697a265161da789a01b068b5ecef7e51d043","body_rewrite":false,"maturity_effect":"NO_CHANGE","authority_boundary_preserved":true,"dispositions":[{"gap_id":"ai-safety-engineer-boundary-gap","decision":"ADOPTED","target_files":["maps/profession.json"],"rationale":"Compile boundary into package-local map without widening maturity.","residual_gap":"Observed practice and cross-intelligence execution remain untested."}],"adopted_files":["maps/profession.json"],"nonclaims":["Ai Safety Engineer remains EXPERIMENTAL.","Occupational grounding does not prove competence."]}