{"schema_version":"0.1","profession_id":"data-scientist","compiled_on":"2026-09-12","research_packet":"research/cohorts/31-40/data-scientist.json","research_packet_blob_sha":"cf6b762c1c9f90db3b8f9730dc971e46b6b3a7f7","audited_body_blob_sha":"606b77607b3152fc17429d551d6822b5c94744da","body_rewrite":false,"maturity_effect":"NO_CHANGE","authority_boundary_preserved":true,"dispositions":[{"gap_id":"datascience-exploration-inference-boundary-gap","decision":"ADOPTED","target_files":["maps/profession.json"],"rationale":"Even with a strong exact occupational crosswalk, the package must keep exploratory/predictive evidence separate from causal/statistical/domain/product authority.","residual_gap":"Observed data-science practice, domain diversity and cross-intelligence evidence remain untested."}],"adopted_files":["maps/profession.json"],"nonclaims":["Data Scientist remains EXPERIMENTAL.","No TEST scope or causal/product/domain claim is created.","Production ML and statistical inference remain separately owned when material."]}
