{"schema_version":"0.1","profession_id":"data-quality-engineer","compiled_on":"2026-09-12","research_packet":"research/cohorts/41-50/data-quality-engineer.json","research_packet_blob_sha":"7925f61e2ad9ac7730a17ea88eb7a00ae38f40a7","audited_body_blob_sha":"6541c8699e952e77d70efe92ebddd209ffc26d9b","body_rewrite":false,"maturity_effect":"NO_CHANGE","authority_boundary_preserved":true,"dispositions":[{"gap_id":"data-quality-engineer-boundary-gap","decision":"ADOPTED","target_files":["maps/profession.json"],"rationale":"Compile boundary into package-local map without widening maturity.","residual_gap":"Observed practice and cross-intelligence execution remain untested."}],"adopted_files":["maps/profession.json"],"nonclaims":["Data Quality Engineer remains EXPERIMENTAL.","Occupational grounding does not prove competence."]}