{"schema_version":"0.1","profession_id":"interaction-designer","compiled_on":"2026-09-12","research_packet":"research/cohorts/61-70/interaction-designer.json","research_packet_blob_sha":"51d9b42811fcddf44871f3cfe49d72bfdf70a6df","audited_body_blob_sha":"10f1fb6f3c6a692250b1c9de8fb2a7da4a1af0bc","body_rewrite":false,"maturity_effect":"NO_CHANGE","authority_boundary_preserved":true,"dispositions":[{"gap_id":"interaction-designer-boundary-gap","decision":"ADOPTED","target_files":["maps/profession.json"],"rationale":"Compile the research-backed boundary into the package-local map without widening maturity.","residual_gap":"Observed practice, broader human-profession depth and cross-intelligence execution remain untested."}],"adopted_files":["maps/profession.json"],"nonclaims":["Interaction Designer remains EXPERIMENTAL.","Occupational grounding and schema-valid package structure do not prove competence."]}