{"schema_version":"0.1","profession_id":"software-qa-playtest","compiled_on":"2026-09-12","research_packet":"research/pilots/software-qa-playtest.json","research_packet_blob_sha":"8917c408674dab6bbf581a93be2f69053a8d96b6","audited_body_blob_sha":"7ed67b12c35198f5e87d51ece1732d0c66b7b6cb","body_rewrite":false,"maturity_effect":"NO_CHANGE","authority_boundary_preserved":true,"dispositions":[{"gap_id":"qa-defect-lifecycle-gap","decision":"ADOPTED","target_files":["tools/defect-lifecycle.json"],"rationale":"Compile a stable defect/known-failure lifecycle contract without granting QA product priority or implementation ownership.","residual_gap":"Broader enterprise defect-management conventions remain institution-specific."},{"gap_id":"qa-test-environment-lifecycle-gap","decision":"HOLD","target_files":[],"rationale":"The occupational signal is real but environment calibration, drift and fitness-for-purpose need deeper practice evidence before compilation.","residual_gap":"Test-environment/tool configuration, calibration and drift handling remain uncompiled."},{"gap_id":"qa-design-review-handoff-gap","decision":"ADOPTED","target_files":["handoffs/design-review.json"],"rationale":"Add pre-implementation testability/risk consultation while preserving Product/Design ownership of intended behavior.","residual_gap":"No product/design decision authority is transferred to QA."}],"adopted_files":["maps/research-adoption.json","tools/defect-lifecycle.json","handoffs/design-review.json"],"nonclaims":["New defect-lifecycle and design-review machinery is NOT_TESTED and does not widen the existing QA scoped TEST record.","This compilation does not claim enterprise/mobile/load/accessibility/security/regulatory QA completeness."]}