{"schema_version":"0.1","profession_id":"security-operations-analyst","compiled_on":"2026-09-12","research_packet":"research/cohorts/71-78/security-operations-analyst.json","research_packet_blob_sha":"5d2d71ee9d47cf8aa8f929040c38fd3b3f10b19c","audited_body_blob_sha":"a3e829d51de3b0327e934f8fa47ff4e7e99732de","body_rewrite":false,"maturity_effect":"NO_CHANGE","authority_boundary_preserved":true,"dispositions":[{"gap_id":"security-operations-analyst-boundary-gap","decision":"ADOPTED","target_files":["maps/profession.json"],"rationale":"Compile the research-backed boundary without widening maturity.","residual_gap":"Observed practice and cross-intelligence execution remain untested."}],"adopted_files":["maps/profession.json"],"nonclaims":["Security Operations Analyst remains EXPERIMENTAL.","No authorization, permission, certification, risk acceptance, legal authority or physical/security access is created by this compilation."]}