{"schema_version":"0.1","profession_id":"performance-engineer","compiled_on":"2026-09-12","research_packet":"research/cohorts/41-50/performance-engineer.json","research_packet_blob_sha":"5d4a39e8d8dcf219324ee646bb7a8673f20e4b50","audited_body_blob_sha":"0198697b3abf95a8b50066d6ff383c0cca1d511a","body_rewrite":false,"maturity_effect":"NO_CHANGE","authority_boundary_preserved":true,"dispositions":[{"gap_id":"performance-engineer-boundary-gap","decision":"ADOPTED","target_files":["maps/profession.json"],"rationale":"Compile boundary into package-local map without widening maturity.","residual_gap":"Observed practice and cross-intelligence execution remain untested."}],"adopted_files":["maps/profession.json"],"nonclaims":["Software Performance Engineer remains EXPERIMENTAL.","Occupational grounding does not prove competence."]}