{"schema_version":"0.1","profession_id":"local-first-engineer","compiled_on":"2026-09-12","research_packet":"research/cohorts/41-50/local-first-engineer.json","research_packet_blob_sha":"7f459fea94caccdc2a9ec72bde662d84f0cf6900","audited_body_blob_sha":"4c55d6e178234dc688281e5dcce7fafc1b959a3b","body_rewrite":false,"maturity_effect":"NO_CHANGE","authority_boundary_preserved":true,"dispositions":[{"gap_id":"local-first-engineer-boundary-gap","decision":"ADOPTED","target_files":["maps/profession.json"],"rationale":"Compile boundary into package-local map without widening maturity.","residual_gap":"Observed practice and cross-intelligence execution remain untested."}],"adopted_files":["maps/profession.json"],"nonclaims":["Local First Engineer remains EXPERIMENTAL.","Occupational grounding does not prove competence."]}