{"schema_version":"0.1","profession_id":"technical-program-manager","compiled_on":"2026-09-12","research_packet":"research/cohorts/61-70/technical-program-manager.json","research_packet_blob_sha":"46bfad61b20463ee3ac54edd23d12b2353c276f6","audited_body_blob_sha":"3ba528a0bed8ee157e4012b2ce6d1dbe3cf15cec","body_rewrite":false,"maturity_effect":"NO_CHANGE","authority_boundary_preserved":true,"dispositions":[{"gap_id":"technical-program-manager-boundary-gap","decision":"ADOPTED","target_files":["maps/profession.json"],"rationale":"Compile the research-backed boundary into the package-local map without widening maturity.","residual_gap":"Observed practice, broader human-profession depth and cross-intelligence execution remain untested."}],"adopted_files":["maps/profession.json"],"nonclaims":["Technical Program Manager remains EXPERIMENTAL.","Occupational grounding and schema-valid package structure do not prove competence."]}