{"schema_version":"0.1","profession_id":"release-manager-software","compiled_on":"2026-09-12","research_packet":"research/cohorts/51-60/release-manager-software.json","research_packet_blob_sha":"8015caa869f43c00827d905121133eb1c65190f3","audited_body_blob_sha":"24c03a37b54fe22b21db309801da52a7e5fd40e1","body_rewrite":false,"maturity_effect":"NO_CHANGE","authority_boundary_preserved":true,"dispositions":[{"gap_id":"release-manager-software-boundary-gap","decision":"ADOPTED","target_files":["maps/profession.json"],"rationale":"Compile the research-backed boundary into the package-local map without widening maturity.","residual_gap":"Observed practice, broader human-profession depth and cross-intelligence execution remain untested."}],"adopted_files":["maps/profession.json"],"nonclaims":["Software Release Manager remains EXPERIMENTAL.","Occupational grounding and schema-valid package structure do not prove competence."]}