{"schema_version":"0.1","profession_id":"maintenance-engineer","compiled_on":"2026-09-12","research_packet":"research/pilots/maintenance-engineer.json","research_packet_blob_sha":"484dec73ee94460bcde1832ae75585fa230d88ff","audited_body_blob_sha":"6b9c2b3181e8235552a41abb4f9a397107dc8d00","body_rewrite":false,"maturity_effect":"NO_CHANGE","authority_boundary_preserved":true,"dispositions":[{"gap_id":"maintenance-physical-execution-map-gap","decision":"PARTIAL","target_files":["maps/physical-execution-boundary.json"],"rationale":"Compile only execution classes, evidence interfaces and hard STOP boundaries; do not compile physical work instructions from broad occupational evidence.","residual_gap":"Tool-specific physical inspection/repair/alignment/installation practice requires deeper task, OEM, site and safety research."},{"gap_id":"maintenance-parts-provenance-gap","decision":"ADOPTED","target_files":["tools/parts-provenance.json"],"rationale":"Add exact part/revision/compatibility/procurement provenance so automated similarity cannot silently substitute components.","residual_gap":"Institution-specific procurement approval remains external."},{"gap_id":"maintenance-document-version-gap","decision":"ADOPTED","target_files":["tools/technical-document-registry.json"],"rationale":"Bind manuals/drawings/diagrams/catalogs to exact asset/configuration/revision and preserve supersession state.","residual_gap":"Document authority and site/OEM approval rules remain context-specific."},{"gap_id":"maintenance-trade-authorization-gap","decision":"ADOPTED","target_files":["handoffs/licensed-trade.json"],"rationale":"Make competent-person/licensed-trade/site-role routing explicit when executor skill or authority is insufficient.","residual_gap":"Jurisdiction/site-specific credential rules still require current local authority data."}],"adopted_files":["maps/research-adoption.json","maps/physical-execution-boundary.json","tools/parts-provenance.json","tools/technical-document-registry.json","handoffs/licensed-trade.json"],"nonclaims":["This compilation grants no authority or permission to inspect, isolate, energize, open, repair, align, install, test or return physical equipment to service.","No part substitution is authorized from text similarity or model confidence.","Physical execution depth remains PARTIAL and NOT_TESTED."]}