{"schema_version":"0.1","profession_id":"vendor-management-specialist","compiled_on":"2026-09-12","research_packet":"research/cohorts/79-89/vendor-management-specialist.json","research_packet_blob_sha":"9f8cdea59e568f217878dec9491f981859ee4350","audited_body_blob_sha":"fadc49c800cfc994e9b41eba8f12aa00cc7858e7","body_rewrite":false,"maturity_effect":"NO_CHANGE","authority_boundary_preserved":true,"dispositions":[{"gap_id":"vendor-management-specialist-boundary-gap","decision":"ADOPTED","target_files":["maps/profession.json"],"rationale":"Compile the research-backed boundary without widening maturity.","residual_gap":"Observed practice and cross-intelligence execution remain untested."}],"adopted_files":["maps/profession.json"],"nonclaims":["Vendor Management Specialist remains EXPERIMENTAL.","Occupational grounding/package validity do not prove professional competence or grant institutional authority."]}