{"schema_version":"0.1","profession_id":"synthetic-data-specialist","compiled_on":"2026-09-12","research_packet":"research/cohorts/61-70/synthetic-data-specialist.json","research_packet_blob_sha":"fc8c96edf200e29050f65680269be83d9d3b6561","audited_body_blob_sha":"7ac8444ec9a6a1373a221da68c3ca5edf9fcb9fe","body_rewrite":false,"maturity_effect":"NO_CHANGE","authority_boundary_preserved":true,"dispositions":[{"gap_id":"synthetic-data-specialist-boundary-gap","decision":"ADOPTED","target_files":["maps/profession.json"],"rationale":"Compile the research-backed boundary into the package-local map without widening maturity.","residual_gap":"Observed practice, broader human-profession depth and cross-intelligence execution remain untested."}],"adopted_files":["maps/profession.json"],"nonclaims":["Synthetic Data Specialist remains EXPERIMENTAL.","Occupational grounding and schema-valid package structure do not prove competence."]}