{"schema_version":"0.1","profession_id":"ontology-engineer","compiled_on":"2026-09-12","research_packet":"research/cohorts/31-40/ontology-engineer.json","research_packet_blob_sha":"653d7ebd42d02936601d99cd8a5809376412ad82","audited_body_blob_sha":"d34af9ecef209a7dda53022060f9cd78235c7ab6","body_rewrite":false,"maturity_effect":"NO_CHANGE","authority_boundary_preserved":true,"dispositions":[{"gap_id":"ontology-domain-authority-gap","decision":"ADOPTED","target_files":["maps/profession.json"],"rationale":"No exact occupational mapping exists, so the package makes the formalization-versus-domain-truth boundary explicit rather than letting reasoner consistency become semantic authority.","residual_gap":"Observed ontology practice, multi-domain validation and cross-intelligence evidence remain untested."}],"adopted_files":["maps/profession.json"],"nonclaims":["Ontology Engineer remains EXPERIMENTAL.","No TEST scope or domain-truth authority is created.","RDF 1.2 status is Candidate Recommendation Snapshot, while OWL 2 Second Edition is referenced as a W3C Recommendation; no W3C specification text is reproduced as AXM canon."]}
